{
  "id": "new-echo",
  "slug": "new-echo",
  "title": "New Echo",
  "mode": "echo",
  "palette": "pulse",
  "instructions": "Repeat the shown pattern with 1, 2, 3, and 4.",
  "hud": {
    "modeLabel": "Repeat Pattern"
  },
  "overlay": {
    "startTitle": "New Echo",
    "startCopy": "Greyboxed memory challenge.",
    "startAction": "Start Loop"
  },
  "visuals": {
    "spriteKey": "padTile",
    "accentSpriteKey": "padTile",
    "hazardSpriteKey": "hazardBlock",
    "trailEffectKey": "smoke",
    "impactEffectKey": "spark"
  },
  "settings": {
    "title": "Settings",
    "sections": [
      {
        "title": "Gameplay",
        "controls": [
          {
            "key": "difficulty",
            "label": "Difficulty",
            "type": "select",
            "value": "normal",
            "options": [
              "easy",
              "normal",
              "hard"
            ]
          },
          {
            "key": "effectIntensity",
            "label": "Effect Intensity",
            "type": "range",
            "value": 0.75,
            "min": 0,
            "max": 1,
            "step": 0.05
          }
        ]
      }
    ]
  },
  "help": {
    "title": "How To Start",
    "steps": [
      "Press Start in the center overlay.",
      "Use the listed controls to begin the run.",
      "Watch the HUD goal and react to the first pattern."
    ],
    "tips": [
      "Open Settings before the run if you want a different feel.",
      "Open Menu with Escape to restart or resume."
    ]
  },
  "menu": {
    "title": "Pause Menu",
    "actions": [
      {
        "label": "Resume",
        "action": "resume"
      },
      {
        "label": "Restart",
        "action": "restart"
      },
      {
        "label": "Help",
        "action": "open_help"
      },
      {
        "label": "Settings",
        "action": "open_settings"
      }
    ]
  },
  "onboarding": {
    "title": "Get Started",
    "startSteps": [
      "Open Help if you need the controls.",
      "Press Start to enter gameplay.",
      "Learn the first rhythm, route, or hazard pattern before chasing score."
    ],
    "firstGoal": "Learn the opening loop and survive the first pressure ramp."
  },
  "meta": {
    "summary": "Greyboxed arcade game built from schema-bound JSON.",
    "goal": "",
    "controls": "",
    "paletteLabel": "",
    "features": [
      "JSON-driven content",
      "Shared runtime mode",
      "Greyboxed visual treatment"
    ]
  },
  "content": {
    "pattern": [
      0,
      2,
      1,
      3
    ],
    "revealEvery": 0.65,
    "inputMap": {
      "1": 0,
      "2": 1,
      "3": 2,
      "4": 3
    },
    "padColors": [
      "#ff7a9e",
      "#67d5ff",
      "#b68cff",
      "#ffd873"
    ]
  }
}
