{
  "id": "new-lab",
  "slug": "new-lab",
  "title": "New Lab",
  "mode": "labRift",
  "palette": "pulse",
  "instructions": "Move with arrows or WASD and collect objects.",
  "hud": {
    "modeLabel": "Collect Route"
  },
  "overlay": {
    "startTitle": "New Lab",
    "startCopy": "Greyboxed collection room.",
    "startAction": "Start Route"
  },
  "visuals": {
    "spriteKey": "runnerShip",
    "accentSpriteKey": "shardCrystal",
    "hazardSpriteKey": "sentryDrone",
    "trailEffectKey": "smoke",
    "impactEffectKey": "spark"
  },
  "settings": {
    "title": "Settings",
    "sections": [
      {
        "title": "Gameplay",
        "controls": [
          {
            "key": "difficulty",
            "label": "Difficulty",
            "type": "select",
            "value": "normal",
            "options": [
              "easy",
              "normal",
              "hard"
            ]
          },
          {
            "key": "effectIntensity",
            "label": "Effect Intensity",
            "type": "range",
            "value": 0.75,
            "min": 0,
            "max": 1,
            "step": 0.05
          }
        ]
      }
    ]
  },
  "help": {
    "title": "How To Start",
    "steps": [
      "Press Start in the center overlay.",
      "Use the listed controls to begin the run.",
      "Watch the HUD goal and react to the first pattern."
    ],
    "tips": [
      "Open Settings before the run if you want a different feel.",
      "Open Menu with Escape to restart or resume."
    ]
  },
  "menu": {
    "title": "Pause Menu",
    "actions": [
      {
        "label": "Resume",
        "action": "resume"
      },
      {
        "label": "Restart",
        "action": "restart"
      },
      {
        "label": "Help",
        "action": "open_help"
      },
      {
        "label": "Settings",
        "action": "open_settings"
      }
    ]
  },
  "onboarding": {
    "title": "Get Started",
    "startSteps": [
      "Open Help if you need the controls.",
      "Press Start to enter gameplay.",
      "Learn the first rhythm, route, or hazard pattern before chasing score."
    ],
    "firstGoal": "Learn the opening loop and survive the first pressure ramp."
  },
  "meta": {
    "summary": "Greyboxed arcade game built from schema-bound JSON.",
    "goal": "",
    "controls": "",
    "paletteLabel": "",
    "features": [
      "JSON-driven content",
      "Shared runtime mode",
      "Greyboxed visual treatment"
    ]
  },
  "content": {
    "playerSpeed": 240,
    "shards": [
      {
        "x": 0.24,
        "y": 0.2
      },
      {
        "x": 0.36,
        "y": 0.65
      },
      {
        "x": 0.58,
        "y": 0.38
      },
      {
        "x": 0.72,
        "y": 0.76
      }
    ],
    "sentries": [
      {
        "x": 0.42,
        "y": 0.3,
        "rate": 1.2
      },
      {
        "x": 0.66,
        "y": 0.58,
        "rate": 1.5
      }
    ]
  }
}
